{
  "$schema": "http://json-schema.org/draft-07/schema#",
  "$id": "https://forge.dev/schemas/game-profile.schema.json",
  "title": "Forge GameProfile",
  "description": "Conhecimento de UM jogo, independente de hardware. A otimizacao real e resolvida em runtime pelo solver, cruzando este profile com o tier de hardware do usuario. Pesquisa por jogo = linear (N), nunca N x M combos de PC.",
  "type": "object",
  "required": ["id", "name", "detect", "config", "settings"],
  "additionalProperties": false,
  "properties": {
    "id":   { "type": "string", "pattern": "^[a-z0-9_]+$", "description": "Identificador unico, ex: cyberpunk2077" },
    "name": { "type": "string" },
    "schemaVersion": { "type": "integer", "const": 1 },

    "detect": {
      "type": "object",
      "description": "Como o Forge sabe que o jogo existe/roda neste PC.",
      "additionalProperties": false,
      "properties": {
        "process":    { "type": "array", "items": { "type": "string" }, "description": "Nomes de processo/exe" },
        "steamAppId": { "type": "integer" },
        "installKeys":{ "type": "array", "items": { "type": "string" }, "description": "Chaves de registro Uninstall, opcional" }
      }
    },

    "config": {
      "type": "object",
      "description": "Onde e como o jogo guarda as configs graficas.",
      "required": ["format", "path"],
      "additionalProperties": false,
      "properties": {
        "format": { "enum": ["json", "ini", "keyvalues"], "description": "Estrutura do arquivo de config" },
        "path":   { "type": "string", "description": "Caminho com variaveis de ambiente, ex: %LOCALAPPDATA%\\..." },
        "pathGlob": { "type": "string", "description": "Quando o caminho tem segmento variavel (UUID de conta, steamID3), o apply resolve por glob" },
        "writeRequiresGameClosed": { "type": "boolean", "default": true, "description": "Se true, Forge recusa escrever com o jogo aberto (evita sobrescrita no launch)" },
        "regeneratesOnLaunch": { "type": "boolean", "default": false, "description": "Jogo recria/sobrescreve o arquivo ao abrir (ex: CS2). Apply precisa tratar .bak / read-only" },
        "cloudSynced": { "type": "boolean", "default": false, "description": "Parte das settings vive em cloud (ex: Riot). So o que e local e otimizavel" },
        "backup": { "type": "boolean", "default": true, "description": "Forge faz snapshot reversivel antes de qualquer escrita (mesma etica do RestoreEngine)" }
      }
    },

    "settings": {
      "type": "array",
      "description": "Settings graficos otimizaveis. Pesos sao do MODELO de custo (relativos 0..1), nao medidas absolutas; as anchors calibram.",
      "items": {
        "type": "object",
        "required": ["key", "label", "values", "costGpu", "visual"],
        "additionalProperties": false,
        "properties": {
          "key":   { "type": "string", "description": "Chave exata no arquivo de config" },
          "label": { "type": "string", "description": "Nome legivel pro usuario/UI" },
          "verify": { "type": "boolean", "default": false, "description": "true = a key exata ainda nao foi confirmada contra um arquivo real; o apply DEVE validar a existencia da key antes de escrever" },
          "values": { "type": "array", "minItems": 2, "description": "Valores ordenados do MAIS BARATO pro MAIS CARO. Indice = tier de custo. Aceita string ou numero." },
          "costGpu": { "type": "number", "minimum": 0, "maximum": 1, "description": "Peso de custo GPU do valor mais alto" },
          "costCpu": { "type": "number", "minimum": 0, "maximum": 1, "default": 0 },
          "vram":    { "type": "number", "minimum": 0, "maximum": 1, "default": 0, "description": "Pressao de VRAM (textura alta = alto vram, baixo gpu compute)" },
          "visual":  { "type": "number", "minimum": 0, "maximum": 1, "description": "Ganho visual percebido. Solver derruba primeiro o alto-custo/baixo-visual" },
          "competitiveSafeMax": { "description": "Valor maximo que o preset Competitivo permite (ex: sombras baixas pra visibilidade). Opcional." }
        }
      }
    },

    "anchors": {
      "type": "array",
      "description": "Pontos de benchmark publicos pra calibrar o solver. Pesquisa 1-3 por jogo. Dado publico, nao telemetria.",
      "items": {
        "type": "object",
        "required": ["gpuClass", "res", "preset", "fps"],
        "additionalProperties": false,
        "properties": {
          "gpuClass": { "type": "string", "description": "Classe de GPU, ex: 3060Ti" },
          "cpuClass": { "type": "string" },
          "res":      { "type": "string", "description": "ex: 1080p" },
          "preset":   { "type": "string", "description": "ex: High, Ultra, Ultra+RT+DLSSQ" },
          "fps":      { "type": "number" },
          "source":   { "type": "string", "description": "URL/fonte do numero" }
        }
      }
    },

    "notes": { "type": "string" }
  }
}
