{"id":"valorant","name":"VALORANT","schemaVersion":1,"detect":{"process":["VALORANT-Win64-Shipping.exe","VALORANT.exe"]},"config":{"format":"ini","path":"%LOCALAPPDATA%\\VALORANT\\Saved\\Config","pathGlob":"%LOCALAPPDATA%\\VALORANT\\Saved\\Config\\*\\Windows\\GameUserSettings.ini","writeRequiresGameClosed":true,"regeneratesOnLaunch":false,"cloudSynced":true,"backup":true},"settings":[{"key":"sg.ViewDistanceQuality","label":"Distância de Visão","values":["0","1","2"],"costGpu":0.3,"costCpu":0.5,"vram":0.1,"visual":0.25},{"key":"sg.ShadowQuality","label":"Sombras","values":["0","1","2"],"costGpu":0.5,"costCpu":0.15,"vram":0.1,"visual":0.3,"competitiveSafeMax":"0"},{"key":"sg.AntiAliasingQuality","label":"Anti-Aliasing","values":["0","1","2"],"costGpu":0.45,"costCpu":0.05,"vram":0.1,"visual":0.45},{"key":"sg.TextureQuality","label":"Texturas","values":["0","1","2"],"costGpu":0.1,"costCpu":0.05,"vram":0.7,"visual":0.4},{"key":"sg.EffectsQuality","label":"Efeitos","values":["0","1","2"],"costGpu":0.55,"costCpu":0.2,"vram":0.1,"visual":0.3,"competitiveSafeMax":"1"},{"key":"sg.PostProcessQuality","label":"Pós-processamento","values":["0","1","2"],"costGpu":0.4,"costCpu":0.05,"vram":0.1,"visual":0.25,"competitiveSafeMax":"0"},{"key":"sg.FoliageQuality","label":"Folhagem","values":["0","1","2"],"costGpu":0.25,"costCpu":0.3,"vram":0.05,"visual":0.15},{"key":"sg.ShadingQuality","label":"Sombreamento","values":["0","1","2"],"costGpu":0.5,"costCpu":0.1,"vram":0.1,"visual":0.3}],"anchors":[{"gpuClass":"3060Ti","cpuClass":"R5-3600","res":"1080p","preset":"Low (comp)","fps":300,"source":"estimativa: Valorant CPU-bound, R5-3600 teto ~300-400"},{"gpuClass":"3060Ti","res":"1080p","preset":"High","fps":240,"source":"vlr.gg/22227"}],"notes":"Keys sg.* sao scalability do Unreal Engine, confirmadas. So graficos sao locais: crosshair/binds/sens vivem na cloud da Riot, fora do escopo do Forge. Valorant e CPU-bound num R5-3600: o solver deve priorizar settings de custo CPU (ViewDistance, Foliage) pra ganhar fps, nao GPU. Preset Competitivo = tudo no minimo p/ visibilidade + fps."}