{
  "id": "cyberpunk2077",
  "name": "Cyberpunk 2077",
  "schemaVersion": 1,
  "detect": { "process": ["Cyberpunk2077.exe"], "steamAppId": 1091500 },
  "config": {
    "format": "json",
    "path": "%LOCALAPPDATA%\\CD Projekt Red\\Cyberpunk 2077\\UserSettings.json",
    "writeRequiresGameClosed": true,
    "regeneratesOnLaunch": false,
    "cloudSynced": false,
    "backup": true
  },
  "settings": [
    { "key": "ScreenSpaceReflectionsQuality", "label": "Reflexos em Espaço de Tela (SSR)", "verify": true,
      "values": ["Low","Medium","High","Psycho"], "costGpu": 0.95, "costCpu": 0.10, "vram": 0.25, "visual": 0.40,
      "competitiveSafeMax": "Low" },
    { "key": "VolumetricFogResolution", "label": "Névoa Volumétrica", "verify": true,
      "values": ["Low","Medium","High"], "costGpu": 0.80, "costCpu": 0.05, "vram": 0.15, "visual": 0.25,
      "competitiveSafeMax": "Low" },
    { "key": "VolumetricCloudsQuality", "label": "Nuvens Volumétricas", "verify": true,
      "values": ["Off","Low","Medium","High"], "costGpu": 0.55, "costCpu": 0.05, "vram": 0.10, "visual": 0.20 },
    { "key": "LocalShadowQuality", "label": "Qualidade de Sombras Locais", "verify": true,
      "values": ["Low","Medium","High"], "costGpu": 0.70, "costCpu": 0.15, "vram": 0.15, "visual": 0.50 },
    { "key": "DistantShadowsResolution", "label": "Resolução de Sombras Distantes", "verify": true,
      "values": ["Low","Medium","High"], "costGpu": 0.55, "costCpu": 0.25, "vram": 0.15, "visual": 0.35 },
    { "key": "AmbientOcclusionQuality", "label": "Oclusão de Ambiente", "verify": true,
      "values": ["Low","Medium","High"], "costGpu": 0.50, "costCpu": 0.05, "vram": 0.10, "visual": 0.40 },
    { "key": "TextureQuality", "label": "Qualidade de Texturas", "verify": true,
      "values": ["Low","Medium","High"], "costGpu": 0.10, "costCpu": 0.05, "vram": 0.90, "visual": 0.65 },
    { "key": "CrowdDensity", "label": "Densidade de Multidão", "verify": true,
      "values": ["Low","Medium","High"], "costGpu": 0.20, "costCpu": 0.75, "vram": 0.10, "visual": 0.30,
      "competitiveSafeMax": "Low" }
  ],
  "anchors": [
    { "gpuClass": "3060Ti", "cpuClass": "R5-3600", "res": "1080p", "preset": "Ultra (sem RT)", "fps": 60,
      "source": "techspot.com/article/2164-cyberpunk-benchmarks" },
    { "gpuClass": "3060Ti", "res": "1080p", "preset": "Medium (sem RT)", "fps": 122,
      "source": "techspot.com/article/2164-cyberpunk-benchmarks" },
    { "gpuClass": "3060Ti", "res": "1080p", "preset": "Ultra + RT + DLSS Quality", "fps": 70,
      "source": "pcoptimizedsettings.com" }
  ],
  "notes": "SSR e o setting mais pesado do jogo; Volumetric Fog custa muito por pouco visual (alvos primarios do solver). Keys exatas marcadas verify=true: confirmar contra um UserSettings.json real antes do apply escrever. RT so entra se houver folga de orcamento + DLSS disponivel."
}