{"id":"cs2","name":"Counter-Strike 2","schemaVersion":1,"detect":{"process":["cs2.exe"],"steamAppId":730},"config":{"format":"keyvalues","path":"%PROGRAMFILES(X86)%\\Steam\\userdata","pathGlob":"**\\userdata\\*\\730\\local\\cfg\\cs2_video.txt","writeRequiresGameClosed":true,"regeneratesOnLaunch":true,"cloudSynced":true,"backup":true},"settings":[{"key":"setting.cpu_level","label":"Detalhe de Modelos/Texturas (CPU)","verify":true,"values":["0","1","2"],"costGpu":0.15,"costCpu":0.45,"vram":0.2,"visual":0.3},{"key":"setting.gpu_level","label":"Detalhe de Efeitos (GPU)","verify":true,"values":["0","1","2"],"costGpu":0.45,"costCpu":0.1,"vram":0.2,"visual":0.3},{"key":"setting.csm_quality_level","label":"Qualidade de Sombras","verify":true,"values":["0","1","2"],"costGpu":0.5,"costCpu":0.2,"vram":0.1,"visual":0.35,"competitiveSafeMax":"1"},{"key":"setting.shader_quality","label":"Detalhe de Shaders","verify":true,"values":["0","1"],"costGpu":0.4,"costCpu":0.1,"vram":0.1,"visual":0.3},{"key":"setting.gpu_mem_level","label":"Buffer de Texturas","verify":true,"values":["0","1","2"],"costGpu":0.1,"costCpu":0.05,"vram":0.8,"visual":0.4},{"key":"setting.mat_vsync","label":"VSync","verify":true,"values":["0","1"],"costGpu":0.0,"costCpu":0.0,"vram":0.0,"visual":0.0,"competitiveSafeMax":"0"}],"anchors":[{"gpuClass":"3060Ti","cpuClass":"R5-3600","res":"1080p","preset":"Low (comp)","fps":300,"source":"estimativa: CS2 CPU-bound, R5-3600 teto ~250-300 em fight"},{"gpuClass":"3060Ti","res":"1080p","preset":"High","fps":260,"source":"estimativa"}],"notes":"cs2_video.txt e KeyValues da Valve e REGENERA no launch: o apply precisa escrever com o jogo fechado e tratar o cs2_video.txt.bak. Keys verify=true: confirmar nomes/ranges exatos contra um cs2_video.txt real antes de escrever. CS2 e fortemente CPU-bound num R5-3600 — settings GPU mal mexem no fps a 1080p; o solver deve priorizar cpu_level e nao perder visual a toa nos settings GPU."}